{
  "schema": 1,
  "updated": "2026-10-22T01:00:00Z",
  "min_ab": "2.1.62",
  "patches": [
    {
      "id": "2026-10-php85-pregmatch-null",
      "title": "修复 PHP 8 新版 写入页 preg_match(null) 弃用警告",
      "severity": "warn",
      "typecho": { "min": "1.3.0", "max": "1.3.0" },
      "files": [
        {
          "path": "var/Widget/Contents/EditTrait.php",
          "mode": "replace",
          "eol": "lf",
          "sha256_before": [
            "43cf3fb41c22267b0ca7ed0ce97c3df68d194ecc3e5064f02610bbfb4c7dbc03"
          ],
          "sha256_after": "4c81fc44a6d351d0228add79a1246c19624243016d2b795e5a082568f135030d",
          "after": "patches/2026-10-php85-pregmatch-null/1.3.0/after/var/Widget/Contents/EditTrait.php",
          "diff": "patches/2026-10-php85-pregmatch-null/1.3.0/change.diff",
          "expect": "/\\$name = \\(string\\) \\$item->input->getAttribute\\('name'\\);/"
        }
      ],
      "notes": "PHP 8 新版 把 null 传给 preg_match() 的 $subject 会发 Deprecated。Typecho 在渲染主题自定义字段时，若某个 input 没有 name 属性，getAttribute('name') 返回 null，导致写文章 / 写页面页刷两条「Passing null to parameter #2 of type string is deprecated」（EditTrait.php 第 257、261 行）。补丁只加一个 (string) 转换，null → ''，与原有 'fields[' . $name . ']' 的隐式转换行为完全一致。",
      "refs": [
        "https://github.com/lhl77/typecho-patches/tree/main/patches/2026-10-php85-pregmatch-null"
      ]
    }
  ]
}
